{
  "stops": [
    {
      "stop_id": "mad-stop-atocha",
      "stop_name": "Madrid Atocha Sample",
      "stop_lat": 40.4066,
      "stop_lon": -3.6892,
      "zone_id": "central"
    },
    {
      "stop_id": "mad-stop-sol",
      "stop_name": "Madrid Sol Sample",
      "stop_lat": 40.4169,
      "stop_lon": -3.7035,
      "zone_id": "central"
    },
    {
      "stop_id": "mad-stop-moncloa",
      "stop_name": "Madrid Moncloa Sample",
      "stop_lat": 40.4351,
      "stop_lon": -3.7194,
      "zone_id": "northwest"
    },
    {
      "stop_id": "mad-stop-nuevos-ministerios",
      "stop_name": "Madrid Nuevos Ministerios Sample",
      "stop_lat": 40.4466,
      "stop_lon": -3.6922,
      "zone_id": "north"
    },
    {
      "stop_id": "mad-stop-legazpi",
      "stop_name": "Madrid Legazpi Sample",
      "stop_lat": 40.3912,
      "stop_lon": -3.6959,
      "zone_id": "south"
    }
  ],
  "routes": [
    {
      "route_id": "mad-route-c1",
      "agency_id": "sample-agency",
      "route_short_name": "C1",
      "route_long_name": "Atocha - Sol - Moncloa",
      "route_type": 3
    },
    {
      "route_id": "mad-route-c2",
      "agency_id": "sample-agency",
      "route_short_name": "C2",
      "route_long_name": "Nuevos Ministerios - Sol - Legazpi",
      "route_type": 3
    }
  ],
  "trips": [
    {
      "route_id": "mad-route-c1",
      "service_id": "weekday",
      "trip_id": "mad-trip-c1-am",
      "direction_id": 0,
      "shape_id": "mad-shape-c1"
    },
    {
      "route_id": "mad-route-c2",
      "service_id": "weekday",
      "trip_id": "mad-trip-c2-am",
      "direction_id": 0,
      "shape_id": "mad-shape-c2"
    }
  ],
  "stop_times": [
    {
      "trip_id": "mad-trip-c1-am",
      "arrival_time": "08:00:00",
      "departure_time": "08:00:00",
      "stop_id": "mad-stop-atocha",
      "stop_sequence": 1
    },
    {
      "trip_id": "mad-trip-c1-am",
      "arrival_time": "08:08:00",
      "departure_time": "08:08:00",
      "stop_id": "mad-stop-sol",
      "stop_sequence": 2
    },
    {
      "trip_id": "mad-trip-c1-am",
      "arrival_time": "08:18:00",
      "departure_time": "08:18:00",
      "stop_id": "mad-stop-moncloa",
      "stop_sequence": 3
    },
    {
      "trip_id": "mad-trip-c2-am",
      "arrival_time": "08:05:00",
      "departure_time": "08:05:00",
      "stop_id": "mad-stop-nuevos-ministerios",
      "stop_sequence": 1
    },
    {
      "trip_id": "mad-trip-c2-am",
      "arrival_time": "08:14:00",
      "departure_time": "08:14:00",
      "stop_id": "mad-stop-sol",
      "stop_sequence": 2
    },
    {
      "trip_id": "mad-trip-c2-am",
      "arrival_time": "08:23:00",
      "departure_time": "08:23:00",
      "stop_id": "mad-stop-legazpi",
      "stop_sequence": 3
    }
  ],
  "transfer_benchmark_cases": [
    {
      "case_id": "mob-case-001",
      "origin_stop_id": "mad-stop-atocha",
      "destination_stop_id": "mad-stop-moncloa",
      "query_time": "08:00:00",
      "expected_route_id": "mad-route-c1",
      "expected_trip_id": "mad-trip-c1-am",
      "expected_duration_minutes": 18
    },
    {
      "case_id": "mob-case-002",
      "origin_stop_id": "mad-stop-nuevos-ministerios",
      "destination_stop_id": "mad-stop-legazpi",
      "query_time": "08:05:00",
      "expected_route_id": "mad-route-c2",
      "expected_trip_id": "mad-trip-c2-am",
      "expected_duration_minutes": 18
    },
    {
      "case_id": "mob-case-003",
      "origin_stop_id": "mad-stop-atocha",
      "destination_stop_id": "mad-stop-sol",
      "query_time": "08:00:00",
      "expected_route_id": "mad-route-c1",
      "expected_trip_id": "mad-trip-c1-am",
      "expected_duration_minutes": 8
    }
  ]
}
